{
  "$schema": "https://json-schema.org/draft/2020-12/schema",
  "$id": "manifest-plaindir-v1",
  "type": "object",
  "required": [
    "format_version",
    "required_capabilities",
    "image_id",
    "app_version",
    "created_at",
    "source_path",
    "source_path_flavor",
    "bivignore",
    "repos",
    "agent_sessions"
  ],
  "properties": {
    "format_version": {"type": "integer"},
    "required_capabilities": {"type": "array", "items": {"type": "string"}},
    "image_id": {"type": "string"},
    "app_version": {"type": "string"},
    "created_at": {"type": "string"},
    "source_path": {"type": "string"},
    "source_path_flavor": {"enum": ["posix", "windows", "wsl"]},
    "bivignore": {
      "type": "object",
      "required": ["source", "builtin_id", "sha256"],
      "properties": {
        "source": {"enum": ["file", "builtin"]},
        "builtin_id": {"type": ["string", "null"]},
        "sha256": {"type": "string"}
      }
    },
    "repos": {"type": "array"},
    "agent_sessions": {
      "type": "array",
      "items": {
        "type": "object",
        "required": [
          "agent",
          "agent_version_at_pack",
          "relpath_key",
          "original_path",
          "normalized_path_key",
          "normalization_scheme",
          "path_flavor",
          "provenance",
          "original_session_ids",
          "children",
          "artifacts",
          "live_at_pack",
          "imported_at",
          "entry_schema"
        ],
        "properties": {
          "agent": {"type": "string"},
          "agent_version_at_pack": {"type": "string"},
          "relpath_key": {"type": "string"},
          "original_path": {"type": "string"},
          "normalized_path_key": {"type": "string"},
          "normalization_scheme": {"type": "string"},
          "path_flavor": {"enum": ["posix", "windows", "wsl"]},
          "provenance": {
            "type": "object",
            "required": ["store_root", "locator", "discovery_tier", "archived"],
            "properties": {
              "store_root": {"type": "string"},
              "locator": {"type": "string"},
              "discovery_tier": {"type": "string"},
              "archived": {"type": "boolean"}
            },
            "additionalProperties": true
          },
          "original_session_ids": {
            "type": "object",
            "required": ["primary"],
            "properties": {
              "primary": {"type": "string"},
              "parent": {"type": "string"},
              "parent_in_image": {"type": "boolean"}
            },
            "additionalProperties": true
          },
          "children": {
            "type": "array",
            "items": {
              "type": "object",
              "required": ["original_id", "artifacts"],
              "properties": {
                "original_id": {"type": "string"},
                "artifacts": {"type": "array", "items": {"type": "string"}}
              },
              "additionalProperties": true
            }
          },
          "artifacts": {"type": "array", "items": {"type": "string"}},
          "live_at_pack": {"type": "boolean"},
          "imported_at": {"type": "string"},
          "entry_schema": {"type": "integer"}
        },
        "additionalProperties": true
      }
    }
  },
  "additionalProperties": true
}
