{"format_version":1,"required_capabilities":[],"image_id":"00000000-0000-4000-8000-000000000000","app_version":"0.1.0","created_at":"2026-07-05T00:00:00Z","source_path":"/tmp/plain","source_path_flavor":"posix","bivignore":{"source":"builtin","builtin_id":"builtin-v1","sha256":"abc123"},"repos":[],"agent_sessions":[]}
